{
  "@context": [
    "https://www.w3.org/ns/credentials/v2",
    "https://w3id.org/ixo/context/v1",
    {
      "ixo": "https://w3id.org/ixo/vocab/v1",
      "prov": "http://www.w3.org/ns/prov#",
      "proj": "https://linked.data.gov.au/def/project#",
      "xsd": "http://www.w3.org/2001/XMLSchema#",
      "id": "@id",
      "type": "@type",
      "supportedInterfaces": "ixo:supportedInterfaces",
      "provider": "ixo:provider",
      "version": "schema:version",
      "capabilities": "ixo:capabilities",
      "defaultInputModes": "ixo:defaultInputModes",
      "defaultOutputModes": "ixo:defaultOutputModes",
      "skills": "ixo:skills",
      "signatures": "ixo:signatures",
      "iconUrl": "schema:thumbnailUrl",
      "yoma": "https://w3id.org/yoma/vocab/v1/",
      "relatedDocument": {
        "@id": "schema:subjectOf",
        "@container": "@set"
      },
      "@protected": true
    },
    {
      "topicRecipe": {
        "@id": "https://github.com/ixoworld/topic-protocol/ns/topic-recipe/v1#topicRecipe",
        "@type": "@json"
      },
      "@protected": true
    }
  ],
  "id": "did:ixo:entity:example-topic-recipe#dmn",
  "type": [
    "VerifiableCredential",
    "ixo:DomainCard"
  ],
  "issuer": {
    "id": "did:ixo:entity:example-topic-recipe"
  },
  "validFrom": "2026-09-12T00:00:00Z",
  "credentialSchema": {
    "id": "https://github.com/ixoworld/topic-protocol/schemas/topic-recipe-domain-card/1.1.0-proposed",
    "type": "JsonSchema"
  },
  "credentialSubject": {
    "id": "did:ixo:entity:example-topic-recipe",
    "type": [
      "ixo:protocol/topic"
    ],
    "additionalType": [
      "Topic Recipe"
    ],
    "name": "Accountable work recipe",
    "purpose": "Coordinate delivery of a defined outcome.",
    "function": "Create a task Draft with suggested terms and explicit completion criteria.",
    "systemRole": "topic-recipe",
    "keywords": [
      "topic",
      "recipe",
      "task",
      "accountable-work"
    ],
    "relatedDocument": [
      {
        "type": [
          "schema:DigitalDocument"
        ],
        "id": "did:ixo:entity:example-topic-recipe#top-01",
        "description": "Pinned Topic Shape JSON for recipe version 1.0.0.",
        "mediaType": "application/json"
      }
    ],
    "topicRecipe": {
      "profileVersion": "1.1.0-proposed",
      "entityType": "protocol/topic",
      "version": "1.0.0",
      "protocolVersion": "1.0.0-rc.4",
      "baseKind": "task",
      "baseRecipe": "project",
      "publication": "draft",
      "listingVisibility": "public",
      "instantiation": "reviewable-draft",
      "shapeResource": {
        "id": "did:ixo:entity:example-topic-recipe#top-01",
        "version": "1.0.0",
        "digest": "sha256:0000000000000000000000000000000000000000000000000000000000000000",
        "mediaType": "application/json",
        "vfs": {
          "provider": "ixo-vfs",
          "resource": "did:ixo:entity:example-topic-recipe",
          "fileId": "00000000-0000-4000-8000-000000000001",
          "version": "1"
        },
        "access": {
          "mode": "public",
          "paywall": null
        }
      }
    }
  }
}
